{
  "phase": 6.5,
  "phase_name": "Independent Red-Team Peer Review",
  "status": "COMPLETE",
  "alternative_explanations": [
    {
      "original_finding": "High churn among Fiber Optic customers (contributes to Insights 1 and 3).",
      "finding_ref": "Insight:1",
      "strongest_alt_explanation": "The analysis does not rule out the Phase 0 confound candidate of localized or service-specific outages. The high churn associated with Fiber Optic service may not be due to price or customer fit, but rather to poor service quality (e.g., reliability issues, slower-than-advertised speeds) that the current dataset cannot measure. Competitors may also be targeting these dissatisfied customers more aggressively.",
      "evidence_weighed": "The Phase 6 Confound Sweep did not check for the 'service quality/outages' candidate from Phase 0. Fiber Optic is a premium service where performance expectations are highest; a failure to meet them would be a direct and powerful reason for churn, especially for customers not locked into a contract.",
      "original_survives": true,
      "reasoning": "The original conclusion about Fiber customers being a high-risk segment survives, but the *reason* for the risk is now less certain. The analysis correctly identifies the *what* (high churn in this segment) but this alternative explanation challenges the implied *why*. The intervention (e.g., offering a longer contract) might be ineffective if the root cause is poor service quality."
    },
    {
      "original_finding": "The root cause of high early-life churn is a go-to-market strategy that attracts low-intent customers (H2).",
      "finding_ref": "RootCause:H2",
      "strongest_alt_explanation": "The root cause is not necessarily acquiring 'low-intent' customers, but a 'service reality gap'. Customers sign up based on marketing promises of high performance (especially for Fiber Optic), and the actual service delivered in the first few months fails to meet that expectation, leading to churn. This is a failure of product delivery, not acquisition targeting.",
      "evidence_weighed": "The Phase 4 multivariate analysis shows the highest churn is for Fiber customers on month-to-month contracts. This is consistent with a 'try-and-reject' pattern driven by a disappointing initial product experience. This explanation is more specific and actionable (fix the service) than the more generic 'low-intent customers' hypothesis.",
      "original_survives": false,
      "reasoning": "The original root cause is plausible but generic. The 'service reality gap' explanation is more specific, better fits the evidence about Fiber Optic service, and points to a different set of potential solutions (e.g., improving service reliability, managing expectations during onboarding) that the original analysis overlooks."
    }
  ],
  "confound_sweep_verification": {
    "dimensions_covered_by_phase_6": [
      "InternetService",
      "Contract",
      "tenure_group"
    ],
    "confound_sweep_gaps": [
      "Acquisition Channel / Source",
      "Region / Geography",
      "Specific plan/bundle details"
    ],
    "known_event_candidates_all_checked": false,
    "verification_notes": "The confound sweep did not check the 'Localized or service-specific outages/quality issues' candidate from Phase 0. This is a critical gap, as poor service quality is a very strong alternative explanation for the high churn observed among 'Fiber optic' customers, which is a cornerstone finding of the analysis."
  },
  "circular_reasoning_flags": [],
  "overclaim_flags": [
    {
      "finding": "Insight 3: The first year of service is a critical churn period...",
      "stated_confidence": "HIGH",
      "actual_support": "The Phase 6 confound sweep for the underlying hypothesis (H2) produced a 'MIX_SHIFT' verdict, stating 'The true driver is the contract type, not tenure itself'. The high confidence in tenure as a primary driver is therefore not supported by the analysis's own findings.",
      "corrected_confidence": "MEDIUM",
      "reasoning": "Presenting tenure as a primary driver with high confidence directly contradicts the confound sweep's conclusion that it's an artifact of contract mix. The insight should be rephrased to focus on the combination of new customers AND month-to-month contracts, or the confidence should be lowered to reflect the mix-shift effect."
    },
    {
      "finding": "Insight 2: Customers paying by Electronic Check are a major flight risk...",
      "stated_confidence": "HIGH",
      "actual_support": "The reported Odds Ratio for this effect varies significantly between phases. Phase 5 reports a large OR of 2.55. Phase 6's full model reports a much smaller (though still significant) OR of 1.36. Phrasing based on the larger effect size overstates the impact found in the final model.",
      "corrected_confidence": "HIGH",
      "reasoning": "The 'HIGH' confidence rating is defensible due to strong statistical significance and robustness across segments. However, the narrative must use the more conservative effect size from the final multivariate model (OR=1.36) to avoid overstating the magnitude of the opportunity. This is a precision-and-magnitude issue, not a confidence issue."
    }
  ],
  "verdict": "PROCEED_WITH_REVISIONS",
  "verdict_reasoning": "The analysis has successfully incorporated two prior rounds of red-team feedback and is now substantially more robust. The core findings about Month-to-Month contracts and Electronic Check payment methods hold up to scrutiny. However, two issues require revision before shipping: 1) The analysis overstates its confidence in 'tenure' as a direct driver, contradicting its own confound sweep which correctly identified a mix-shift effect from contract type. 2) The analysis fails to consider a critical alternative explanation for high Fiber Optic churn\u2014poor service quality\u2014which was flagged as a confound candidate in Phase 0 but never swept. These revisions are necessary for accuracy and to provide the stakeholder with a complete picture of potential root causes.",
  "required_revisions": [
    "Rephrase Insight 3 and its associated narrative to reflect the Phase 6 confound sweep finding. The focus should be on the interaction between new customers and month-to-month contracts, not on 'tenure' as a standalone driver. The confidence level must be downgraded from HIGH to MEDIUM.",
    "Add a prominent caveat to all findings related to 'Fiber optic' churn (especially Insights 1 and 3) stating that service quality/reliability issues, a known industry churn driver, could not be evaluated with this data but represent a strong alternative explanation for the observed high churn.",
    "Ensure that the narrative for Insight 2 (Electronic Check) uses the more conservative odds ratio (1.36) from the final multivariate model in Phase 6, not the larger one from the initial bivariate test in Phase 5, to accurately represent the effect's magnitude."
  ]
}