{
  "phase": 6.5,
  "phase_name": "Independent Red-Team Peer Review",
  "status": "COMPLETE",
  "alternative_explanations": [
    {
      "original_finding": "The root cause of the 'organic' (non-reseller) Enterprise churn increase is the 15% price increase.",
      "finding_ref": "RootCause:Enterprise Churn Spike",
      "strongest_alt_explanation": "The price hike isn't the cause, but rather a catalyst that accelerated churn for an already-at-risk customer segment. The analysis did not control for customer tenure or product usage. It's plausible that the customers who churned were predominantly newer customers (<1 year tenure) or low-engagement users who hadn't adopted sticky features. In this scenario, the root cause is not the price itself, but a pre-existing value gap for a specific customer profile that the price change merely brought to a decision point.",
      "evidence_weighed": "The original analysis shows a strong correlation between renewing after April 1st and churning (H3). However, the confound sweep in Phase 6 explicitly notes that 'Customer Tenure' was not available for analysis. Without segmenting the post-hike churners by tenure or usage, we cannot rule out this composition effect. A 60% relative increase in churn (5.1% to 8.2%) is large, and it's unlikely that price alone, without an underlying value perception issue, would cause this across a homogenous group of happy customers.",
      "original_survives": false,
      "reasoning": "The original conclusion of a 'CONFIRMED' root cause does not survive because it fails to rule out a plausible composition effect. The analysis correctly isolates the reseller confound but stops there. The conclusion must be downgraded from a confirmed cause to a hypothesized association."
    },
    {
      "original_finding": "The increase in Pro tier churn is due to unknown external factors or subtle product issues.",
      "finding_ref": "RootCause:Pro Tier Churn Increase",
      "strongest_alt_explanation": "The Pro tier churn increase is a second-order effect of the major changes in the Enterprise tier. For example, a sales team re-tasked with defending high-value Enterprise accounts against price-hike-related churn may have de-prioritized proactive renewals for the Pro tier. Alternatively, marketing communications about the new Enterprise pricing may have created fear and uncertainty among Pro customers about their own future pricing, prompting a premature search for alternatives. This 'organizational distraction' or 'communication spillover' is a more direct internal explanation than hypothesizing an unobserved competitor action.",
      "evidence_weighed": "The original analysis correctly finds no known event in the confound calendar that directly targeted the Pro tier. However, the calendar also shows two major, concurrent events in the Enterprise tier that would consume significant attention from sales, success, and marketing teams. It is highly plausible that this internal focus shift would have unintended consequences on other tiers. This explanation uses the existing evidence of internal events, whereas the original explanation hypothesizes external events for which there is no evidence.",
      "original_survives": true,
      "reasoning": "The original conclusion that the root cause is 'HYPOTHESISED' survives, as does the need for more data (e.g., exit surveys). However, this alternative provides a more specific and testable internal hypothesis for the follow-up investigation, which should be included in the final report."
    }
  ],
  "confound_sweep_verification": {
    "dimensions_covered_by_phase_6": [
      "is_reseller_cohort"
    ],
    "confound_sweep_gaps": [
      "Customer Tenure: This is a critical gap. Newer customers are often more price-sensitive and less embedded than tenured ones. The analysis of the price hike's impact (H3) is weakened by not segmenting by tenure.",
      "Acquisition Source/Channel: This dimension was not checked. Customers acquired through different channels (e.g., product-led growth vs. outbound sales) can have fundamentally different retention profiles and price sensitivity.",
      "Region: Noted as a gap in the original analysis.",
      "Other Resellers: The analysis focused on the single terminated reseller. It's unclear if other, smaller resellers were segmented out or if their performance changed.",
      "Product Usage Intensity: Not available in the data, but a key predictor of churn. High-usage customers are less likely to be price sensitive."
    ],
    "known_event_candidates_all_checked": true,
    "verification_notes": "The sweep was successful in checking the major known events from Phase 0. However, it failed to check for confounding effects across standard business dimensions like customer tenure and acquisition channel, which weakens the causal attribution of the price hike's impact."
  },
  "circular_reasoning_flags": [
    {
      "phase": "5",
      "field": "test_selection_reasoning",
      "quoted_reasoning": "This test is appropriate for determining if there is a statistically significant association between two categorical variables: 'plan_tier' (Enterprise, Pro, Basic) and 'churn_status' (Churned, Not Churned).",
      "issue": "This is circular reasoning. It states the test is for categorical variables because the data is categorical. It doesn't explain *why* this test is the right choice to answer the business question, beyond the data format. A better reason would be: 'To test the VP's hypothesis that the churn problem is specific to one tier, we need to see if the proportion of churned customers is independent of tier. The Chi-squared test is the standard method for evaluating the independence of two categorical variables.'"
    }
  ],
  "overclaim_flags": [
    {
      "finding": "The root cause of the organic Enterprise churn spike is 'CONFIRMED' to be the 15% price increase.",
      "stated_confidence": "CONFIRMED",
      "actual_support": "The analysis shows a statistically significant correlation between renewing after the price hike and a higher churn rate. This is an observational finding and does not prove causation, as other factors (e.g., customer tenure) were not controlled for.",
      "corrected_confidence": "HYPOTHESISED",
      "reasoning": "Claiming a 'CONFIRMED' root cause from a correlational analysis is a significant overclaim. The analysis did not use causal inference methods (e.g., diff-in-diff, RDD) and did not control for potential confounding variables beyond the reseller cohort. The status must be downgraded to reflect this."
    },
    {
      "finding": "Insight Rank 1: '...a ~60% relative increase in 'organic' churn driven by the price hike.'",
      "stated_confidence": "HIGH (implicit in 'driven by' causal language)",
      "actual_support": "The data supports the statement '...associated with the price hike.' Causal language like 'driven by' is too strong.",
      "corrected_confidence": "HIGH (for the association), but language must be changed to correlational.",
      "reasoning": "The analysis strongly supports an association, but asserting a causal driver without a controlled experiment or more advanced modeling is an overclaim. The language should be precise to reflect an observational, not experimental, finding."
    },
    {
      "finding": "The impact of the price hike is an avoidable '$10.85M in churned MRR per quarter.'",
      "stated_confidence": "MEDIUM",
      "actual_support": "This estimate rests on the critical and unverified assumption that 100% of the 3.1 percentage point churn lift is attributable solely to the price hike and is fully reversible. It also uses an assumed average MRR. The uncertainty is much higher than 'MEDIUM'.",
      "corrected_confidence": "LOW",
      "reasoning": "The confidence level for a financial projection based on a correlational finding and multiple unverified assumptions should be low. Presenting this with MEDIUM confidence creates a false sense of precision and risk for the stakeholder who might act on it."
    }
  ],
  "verdict": "PROCEED_WITH_REVISIONS",
  "verdict_reasoning": "The analysis successfully identified and separated the two primary drivers of the Enterprise churn spike (reseller loss and price-hike-associated churn), which is the core of the mission. It correctly refutes the mix-shift hypothesis. However, it overstates the certainty of its conclusions regarding the price hike's causal role, which could lead to flawed strategic decisions. The required revisions are crucial for communicating the findings accurately and without overstating the evidence.",
  "required_revisions": [
    "In the 'Enterprise Churn Spike' root cause chain (Phase 6), change the `status` of the root cause from 'CONFIRMED' to 'HYPOTHESISED'.",
    "In the ranked insights (Phase 6/7/8), rephrase causal language like 'driven by the price hike' to correlational language such as 'associated with the price hike'.",
    "Add a specific caveat to the final report stating that the price hike's impact was not controlled for other key customer attributes like tenure or acquisition channel, and therefore the association may be influenced by confounding variables.",
    "In the 'impact_quantification' section (Phase 6), downgrade the `confidence` of the $10.85M MRR opportunity estimate from 'MEDIUM' to 'LOW' and ensure the underlying assumptions are highlighted prominently."
  ]
}