{
  "phase": 6.5,
  "phase_name": "Independent Red-Team Peer Review",
  "status": "COMPLETE",
  "alternative_explanations": [
    {
      "original_finding": "Paid-search cohorts churn 8.4pp more than organic cohorts (H1, HIGH confidence).",
      "finding_ref": "H1",
      "strongest_alt_explanation": "Paid-search buyers skew toward the Pro tier that took the mid-quarter price increase, so the channel gap could be a tier-mix artefact rather than channel quality.",
      "evidence_weighed": "Phase 6 confound sweep shows the gap holds within every plan tier (largest in Pro at 11.2pp) and predates the pricing change, which rules out pure mix shift.",
      "original_survives": true,
      "reasoning": "The within-tier persistence is exactly the test the mix-shift explanation fails; the original conclusion stands."
    },
    {
      "original_finding": "Low 30-day engagement causes voluntary churn (H2, HIGH confidence).",
      "finding_ref": "H2",
      "strongest_alt_explanation": "Reverse causation: users who have already decided to leave stop engaging, so low engagement is a symptom, not a driver.",
      "evidence_weighed": "The data is observational and the engagement window precedes churn measurement, but intent cannot be observed; neither direction is excluded.",
      "original_survives": true,
      "reasoning": "Survives as an association with predictive value, but the causal framing must stay qualified — the report should say 'predicts', not 'causes'."
    }
  ],
  "confound_sweep_verification": {
    "dimensions_covered_by_phase_6": ["plan_tier", "signup_month_cohort", "region", "acquisition_channel"],
    "confound_sweep_gaps": ["device_type was not sweepable (not extracted) — noted by Phase 6, acceptable for this question"],
    "known_event_candidates_all_checked": true,
    "verification_notes": "Both Phase 0 confound candidates were explicitly weighed against every headline finding; the pricing change was correctly attributed as EVENT_DRIVEN for H3."
  },
  "circular_reasoning_flags": [],
  "overclaim_flags": [
    {
      "finding": "H2 engagement-churn relationship described as a driver",
      "stated_confidence": "HIGH (causal framing)",
      "actual_support": "Observational association with strong effect size; reverse causation not excluded",
      "corrected_confidence": "HIGH as a predictor, qualified causal language",
      "reasoning": "Statistically solid but the causal wording exceeds the design; Phase 8 must use predictive framing."
    }
  ],
  "verdict": "PROCEED_WITH_REVISIONS",
  "verdict_reasoning": "The analysis is sound — findings survived their strongest rivals — but one causal overclaim must be reworded before it reaches an executive audience.",
  "required_revisions": [
    "Reword H2 in the report from 'low engagement causes churn' to 'low engagement predicts churn'; add reverse-causation caveat."
  ]
}
